{
  "id": "enlightenment-vs-burke",
  "from": { "kind": "MOVEMENT", "slug": "enlightenment" },
  "to": { "kind": "PHILOSOPHER", "slug": "burke" },
  "directness": "ATTESTED",
  "mode": "REACTS_AGAINST",
  "strength": "STRONG",
  "note": {
    "fr": "Dans ses Réflexions sur la Révolution de France, <ph id='burke'>Burke</ph> attaque la politique des Lumières : aux droits abstraits et à la <c id='tabula-rasa'>table rase</c> rationaliste, il oppose les droits hérités, les préjugés utiles et la sagesse accumulée de la tradition. C'est l'acte fondateur du conservatisme moderne.",
    "en": "In his Reflections on the Revolution in France, <ph id='burke'>Burke</ph> attacks Enlightenment politics: to abstract rights and the rationalist <c id='tabula-rasa'>blank slate</c> he opposes inherited rights, useful prejudices and the accumulated wisdom of tradition. It is the founding act of modern conservatism."
  },
  "sources": [
    { "fr": "Burke, Réflexions sur la Révolution de France (1790)", "en": "Burke, Reflections on the Revolution in France (1790)" }
  ],
  "updatedAt": "2026-06-25T00:00:00.000Z"
}
