{
  "id": "epicureanism-vs-stoicism",
  "from": { "kind": "MOVEMENT", "slug": "epicureanism" },
  "to": { "kind": "MOVEMENT", "slug": "stoicism" },
  "directness": "ATTESTED",
  "mode": "REACTS_AGAINST",
  "strength": "STRONG",
  "note": {
    "fr": "Rivalité majeure de l'époque hellénistique : de <ph id='chrysippus'>Chrysippe</ph> aux dialogues où Cicéron la rapporte, le <mv id='stoicism'>stoïcisme</mv> affûte ses thèses contre l'<mv id='epicureanism'>épicurisme</mv>, opposant à la déviation des atomes et au plaisir la providence, le destin et la vertu comme seul bien.",
    "en": "A major rivalry of the Hellenistic age: from <ph id='chrysippus'>Chrysippus</ph> to the dialogues in which Cicero reports it, <mv id='stoicism'>Stoicism</mv> hones its theses against <mv id='epicureanism'>Epicureanism</mv>, setting against the swerve of atoms and pleasure the doctrines of providence, fate and virtue as the only good."
  },
  "sources": [
    { "fr": "Cicéron, Du destin ; Des termes extrêmes des biens et des maux", "en": "Cicero, On Fate; On the Ends of Good and Evil" }
  ],
  "updatedAt": "2026-07-22T00:00:00.000Z"
}
